{
  "$schema": "http://json-schema.org/draft-07/schema#",
  "title": "EnvironmentConfig",
  "type": "object",
  "properties": {
    "version": { "type": "string" },
    "map": {
      "type": "object",
      "properties": {
        "width": { "type": "number", "minimum": 1 },
        "height": { "type": "number", "minimum": 1 }
      },
      "required": ["width", "height"],
      "additionalProperties": false
    },
    "visuals": {
      "type": "object",
      "properties": {
        "mapImageUrl": {
          "type": "string",
          "pattern": "^(https?://.+\\.(png|jpg|jpeg)|/.+\\.(png|jpg|jpeg)|data:image/(png|jpeg);base64,.+)$"
        },
        "playerSpriteUrl": {
          "type": "string",
          "pattern": "^(https?://.+\\.(png|jpg|jpeg)|/.+\\.(png|jpg|jpeg)|data:image/(png|jpeg);base64,.+)$"
        },
        "remotePlayerSpriteUrl": {
          "type": "string",
          "pattern": "^(https?://.+\\.(png|jpg|jpeg)|/.+\\.(png|jpg|jpeg)|data:image/(png|jpeg);base64,.+)$"
        }
      },
      "additionalProperties": false
    },
    "communication": {
      "type": "object",
      "properties": {
        "talkRadius": { "type": "number", "minimum": 1 },
        "maxPeers": { "type": "integer", "minimum": 1, "maximum": 8 }
      },
      "required": ["talkRadius", "maxPeers"],
      "additionalProperties": false
    },
    "objects": {
      "type": "array",
      "items": {
        "type": "object",
        "properties": {
          "type": { "type": "string" },
          "visual": {
            "type": "string",
            "pattern": "^(https?://.+\\.(png|jpg|jpeg)|/.+\\.(png|jpg|jpeg)|data:image/(png|jpeg);base64,.+)$"
          },
          "parameters": {
            "type": "array",
            "items": { "type": "string" },
            "minItems": 1
          }
        },
        "required": ["type", "visual", "parameters"],
        "additionalProperties": false
      }
    },
    "rooms": {
      "type": "array",
      "items": {
        "type": "object",
        "properties": {
          "id": { "type": "string" },
          "name": { "type": "string" },
          "spawnPoint": {
            "type": "object",
            "properties": {
              "x": { "type": "number" },
              "y": { "type": "number" }
            },
            "required": ["x", "y"],
            "additionalProperties": false
          },
          "objects": {
            "type": "array",
            "items": {
              "type": "object",
              "properties": {
                "id": { "type": "string" },
                "type": { "type": "string" },
                "x": { "type": "number" },
                "y": { "type": "number" }
              },
              "required": ["id", "type", "x", "y"],
              "additionalProperties": true
            }
          }
        },
        "required": ["id", "name", "spawnPoint", "objects"],
        "additionalProperties": false
      }
    }
  },
  "required": ["version", "map", "communication", "objects", "rooms"],
  "additionalProperties": false
}
